Title,Published_date,Views,Likes,Comments
"Ep. 29, Pollution and Health: Generating Evidence and Action to Advance Human and Planetary Health",2024-06-03 19:00:19+00:00,3681,0,2
"Ep. 25, Duality of Environmental Justice Conference",2024-04-30 16:30:06+00:00,2092,0,1
"Ep. 22, Organizations and Environmental Sustainability Conference",2024-03-14 18:00:08+00:00,2013,0,3
"Ep. 20, Marketing for Environmental Sustainability Conference",2023-12-16 01:00:02+00:00,4143,0,0
Creating Sustainable Fashion with Handlooms,2023-12-12 22:24:42+00:00,2212,0,2
"Ep. 18, The Political Economics of Environmental Sustainability Conference",2023-11-13 22:00:13+00:00,3518,0,0
2023 Building Momentum: Diversity and Entrepreneurship — Building a Company Organically (Without VC),2023-06-20 21:10:28+00:00,684,0,0
88. Best of: Leading From Home – How to Create the Right Environment for Communication,2023-05-02 14:50:05+00:00,35250,495,7
"Ep. 11, Environmental Justice and Sustainability Conference",2023-04-19 22:00:21+00:00,3695,0,3
"Why We Should Be Cutting Down More Trees to Fight Climate Change | Rae Oakley, MBA ’23",2023-04-08 22:06:38+00:00,2618,0,15
"Ditch the Paper Straw: Examples of Green Supply Chains in Action | Grant McNaughton, MBA ’24",2023-04-08 21:59:21+00:00,980,0,3
"Ep. 6, Organizations and Environmental Sustainability Conference",2023-04-05 01:40:16+00:00,2380,0,1
"Ep. 5, Marketing for Environmental Sustainability Conference",2023-04-05 01:37:27+00:00,1505,0,1
"Ep. 1, The Political Economy of Environmental Sustainability Conference",2023-04-05 01:24:04+00:00,5347,0,1
"Ep. 2, Finance and Environmental Sustainability Conference",2023-04-05 01:06:09+00:00,1869,0,0
Leadership for Society: The Existential Crisis: Addressing Climate Change,2023-02-28 03:24:40+00:00,4068,0,0
"Ep. 7, Operations, Information Technology, and Environmental Sustainability Conference",2023-02-22 05:21:58+00:00,4371,0,4
Alumni Panel:  The Role of Business Leaders in Climate Action,2022-10-24 21:42:19+00:00,3210,0,1
"A Meat-lover’s Guide to Environmentally Conscious Eating | Adrian Kerester, MBA ’22",2022-04-11 15:19:51+00:00,1628,0,0
"Clean and Just: Pursuing A Truly Sustainable Energy Transition | Sankalp Banerjee, MBA ’23",2022-04-11 15:16:00+00:00,3217,0,0
Leadership for Society: Reimagining Work - Work Environment: Who Makes All the Decisions?,2021-09-28 02:21:06+00:00,5274,0,0
Grit & Growth | Masterclass on India’s Venture Capital Ecosystem,2021-08-24 21:51:16+00:00,6267,0,0
"From STEM, Energy, and the Environment to Stanford MBA",2021-07-17 00:35:25+00:00,1545,0,0
"Business + Earth, Energy and Environmental Sciences: Power Grid Stability and Renewable Energy",2021-05-25 16:16:52+00:00,1711,0,0
"Anca Timofte, MBA ’22: Face up to Climate Change. Work on Direct Air Capture.",2021-04-09 17:10:36+00:00,1852,0,0
"GlobalX Climate Change - Christine Wiederkehr-Luther, Head Sustainability at Migros Group",2021-04-06 17:35:02+00:00,626,0,0
"GlobalX Climate Change – Eric Soubeiran, VP Nature & Water Cycle at Danone",2021-03-18 22:43:21+00:00,1185,0,0
"GlobalX Climate Change - Dan Jørgensen, Climate Minister of Denmark",2021-03-04 03:15:29+00:00,1860,0,0
"Catherine Coleman Flowers, Founder, Center for Rural Enterprise and Environmental Justice",2021-02-17 20:09:54+00:00,1110,0,0
A Race and Power Conversation with Environmental Justice Experts,2021-01-26 03:08:55+00:00,2853,0,0
Finding Common Ground on Social and Environmental Issues,2020-06-02 20:41:23+00:00,619,0,0
"Walden Lam, MBA '15: Making Perfectly Fitted Jeans With Zero Waste",2020-04-08 17:30:24+00:00,2847,0,0
